title,title_detail,links,link,id,guidislink,summary,summary_detail,published,published_parsed,media_content,Name,Section,Language,Twitter_URL,FB_URL,Fetched_At
"सलमान के पिता सलीम खान को धमकी:मॉर्निंग वॉक के दौरान स्कूटी सवार महिला बोली- सही से रहो, वर्ना लॉरेंस को बता दूंगी; अरेस्ट","{'type': 'text/plain', 'language': None, 'base': 'https://www.bhaskar.com/rss-v1--category-2318.xml', 'value': 'सलमान के पिता सलीम खान को धमकी:मॉर्निंग वॉक के दौरान स्कूटी सवार महिला बोली- सही से रहो, वर्ना लॉरेंस को बता दूंगी; अरेस्ट'}","[{'rel': 'alternate', 'type': 'text/html', 'href': 'https://www.bhaskar.com/entertainment/bollywood/news/salman-khan-father-salim-khan-receives-threat-from-a-woman-133667900.html'}, {'href': 'https://www.bhaskar.com/entertainment/bollywood/news/salman-khan-father-salim-khan-receives-threat-from-a-woman-133667900.html', 'rel': 'alternate', 'type': 'text/html'}]",https://www.bhaskar.com/entertainment/bollywood/news/salman-khan-father-salim-khan-receives-threat-from-a-woman-133667900.html,https://www.bhaskar.com/entertainment/bollywood/news/salman-khan-father-salim-khan-receives-threat-from-a-woman-133667900.html,False,"अभिनेता सलमान खान के पिता और राइटर सलीम खान को मुंबई में एक महिला ने धमकी दी है। घटना 18 सितंबर की है। सलीम खान मॉर्निंग वॉक के बाद बेंच पर बैठे हुए थे, उसी समय बांद्रा बैंडस्टैंड की तरफ से स्कूटी पर एक शख्स जा रहा था और उसके पीछे एक बुर्का पहने महिला बैठी थी। उसने यू-टर्न लिया और सलीम खान के पास बोली- सही से रहो वर्ना लॉरेंस को बता दूं क्या? स्कूटी का नंबर 7444 था। बांद्रा पुलिस ने केस दर्ज कर स्कूटी वाले शख्स और महिला को हिरासत में ले लिया है। दोनों से पूछताछ की जा रही है। सलमान के घर पर 14 अप्रैल को पांच राउंड फायरिंग हुई थी 
सलमान के मुंबई स्थित घर गैलेक्सी अपार्टमेंट में 14 अप्रैल की सुबह फायरिंग हुई थी। फायरिंग करने वाले बाइक से आए थे। उन्होंने सलमान के घर के बाहर 5 राउंड फायरिंग की और भाग गए। दो दिन बाद मुंबई पुलिस ने आरोपियों को गुजरात से अरेस्ट किया था। मामले में पुलिस ने अब तक लॉरेंस समेत 9 लोगों को आरोपी बनाया है। इनमें से अब तक 6 की गिरफ्तारी हो चुकी है। 1 मई को 6 आरोपियों में से एक अनुज थापन ने पुलिस कस्टडी में आत्महत्या कर ली थी। लॉरेंस पहले से ही अन्य मामलों में जेल में बंद है। सलमान ने कहा था- परिवारवालों को खतरा है 
मुंबई क्राइम ब्रांच की एंटी एक्सटॉर्शन सेल ने फायरिंग मामले में 4 जून को सलमान का बयान रिकॉर्ड किया था। सलमान ने कहा था- ‘उस दिन मैं सो रहा था जब मैंने पटाखों की आवाज सुनी। सुबह के 4.55 बजे थे। पुलिस बॉडीगार्ड ने बताया कि बाइक पर आए दो लोगों ने गैलेक्सी अपार्टमेंट की फर्स्ट फ्लोर की बालकनी पर बंदूक से फायरिंग की है।' सलमान ने ये भी कहा था, पहले भी लॉरेंस और उसकी गैंग ने मुझे और मेरे परिवार को मारने को लेकर एक इंटरव्यू में बात की थी। मुझे विश्वास है कि लॉरेंस ने अपनी गैंग के साथियों की मदद से इस फायरिंग को अंजाम दिया, जब मेरे परिवार के सदस्य सो रहे थे। उसका प्लान मुझे और मेरे परिवार वालों को मारने का था, इसलिए उसने ये हमला करवाया।’ गैलेक्सी अपार्टमेंट में रहते हैं सलीम खान
सलीम खान मुंबई में जुहू इलाके में परिवार के साथ गैलेक्सी अपार्टमेंट में रहते हैं। कोरोना लॉकडाउन के दौरान मॉर्निंग वॉक पर जाने के कारण वो विवादों में भी फंस चुके हैं। तब उन्होंने कहा था कि वे 40 साल से मॉर्निंग वॉक पर जा रहे हैं, क्योंकि उन्हें लोअर बैक में दिक्कत है और डॉक्टर ने उन्हें ऐसा करने की सलाह दी है। 2022 में भी सलीम खान को मिली थी धमकी
2022 में भी सलीम खान ने बांद्रा पुलिस स्टेशन में एक शिकायत दर्ज करवाई थी। उन्हें एक चिट्ठी मिली थी, जिसमें सलमान और उनके परिवार को धमकी दी गई थी। ये खबरें भी पढ़ें... सलमान के घर फायरिंग करने वालों को दाऊद का डर:आरोपी विक्की और सागर का दावा- सलमान के गैंगस्टर्स से संबंध, वो हमें मरवाना चाहते हैं सलमान खान के घर पर फायरिंग करने के आरोप में जेल में बंद विक्की गुप्ता और सागर पाल को अपनी हत्या का डर सता रहा है। न्यूज एजेंसी ANI को आरोपियों के वकील ने बताया कि दोनों ने जेल अधिकारियों से इसकी शिकायत की है। उनके परिवार वालों ने महाराष्ट्र और बिहार सरकार से शिकायत करके सुरक्षा की मांग की है। पूरी खबर पढ़ें... पुलिस का दावा- सलमान की सुपारी दी गई थी:₹25 लाख में डील हुई, पाकिस्तान से AK-47 आनी थी, चार्जशीट में 5 आरोपियों के नाम एक्टर सलमान खान के घर हुई फायरिंग की जांच कर रही नवी मुंबई पुलिस ने नया खुलासा किया है। पुलिस का कहना है कि लॉरेंस गैंग ने सलमान को मारने के लिए 25 लाख रुपए की सुपारी दी थी। पूरी खबर यहां पढ़ें...","{'type': 'text/html', 'language': None, 'base': 'https://www.bhaskar.com/rss-v1--category-2318.xml', 'value': ""अभिनेता सलमान खान के पिता और राइटर सलीम खान को मुंबई में एक महिला ने धमकी दी है। घटना 18 सितंबर की है। सलीम खान मॉर्निंग वॉक के बाद बेंच पर बैठे हुए थे, उसी समय बांद्रा बैंडस्टैंड की तरफ से स्कूटी पर एक शख्स जा रहा था और उसके पीछे एक बुर्का पहने महिला बैठी थी। उसने यू-टर्न लिया और सलीम खान के पास बोली- सही से रहो वर्ना लॉरेंस को बता दूं क्या? स्कूटी का नंबर 7444 था। बांद्रा पुलिस ने केस दर्ज कर स्कूटी वाले शख्स और महिला को हिरासत में ले लिया है। दोनों से पूछताछ की जा रही है। सलमान के घर पर 14 अप्रैल को पांच राउंड फायरिंग हुई थी \nसलमान के मुंबई स्थित घर गैलेक्सी अपार्टमेंट में 14 अप्रैल की सुबह फायरिंग हुई थी। फायरिंग करने वाले बाइक से आए थे। उन्होंने सलमान के घर के बाहर 5 राउंड फायरिंग की और भाग गए। दो दिन बाद मुंबई पुलिस ने आरोपियों को गुजरात से अरेस्ट किया था। मामले में पुलिस ने अब तक लॉरेंस समेत 9 लोगों को आरोपी बनाया है। इनमें से अब तक 6 की गिरफ्तारी हो चुकी है। 1 मई को 6 आरोपियों में से एक अनुज थापन ने पुलिस कस्टडी में आत्महत्या कर ली थी। लॉरेंस पहले से ही अन्य मामलों में जेल में बंद है। सलमान ने कहा था- परिवारवालों को खतरा है \nमुंबई क्राइम ब्रांच की एंटी एक्सटॉर्शन सेल ने फायरिंग मामले में 4 जून को सलमान का बयान रिकॉर्ड किया था। सलमान ने कहा था- ‘उस दिन मैं सो रहा था जब मैंने पटाखों की आवाज सुनी। सुबह के 4.55 बजे थे। पुलिस बॉडीगार्ड ने बताया कि बाइक पर आए दो लोगों ने गैलेक्सी अपार्टमेंट की फर्स्ट फ्लोर की बालकनी पर बंदूक से फायरिंग की है।' सलमान ने ये भी कहा था, पहले भी लॉरेंस और उसकी गैंग ने मुझे और मेरे परिवार को मारने को लेकर एक इंटरव्यू में बात की थी। मुझे विश्वास है कि लॉरेंस ने अपनी गैंग के साथियों की मदद से इस फायरिंग को अंजाम दिया, जब मेरे परिवार के सदस्य सो रहे थे। उसका प्लान मुझे और मेरे परिवार वालों को मारने का था, इसलिए उसने ये हमला करवाया।’ गैलेक्सी अपार्टमेंट में रहते हैं सलीम खान\nसलीम खान मुंबई में जुहू इलाके में परिवार के साथ गैलेक्सी अपार्टमेंट में रहते हैं। कोरोना लॉकडाउन के दौरान मॉर्निंग वॉक पर जाने के कारण वो विवादों में भी फंस चुके हैं। तब उन्होंने कहा था कि वे 40 साल से मॉर्निंग वॉक पर जा रहे हैं, क्योंकि उन्हें लोअर बैक में दिक्कत है और डॉक्टर ने उन्हें ऐसा करने की सलाह दी है। 2022 में भी सलीम खान को मिली थी धमकी\n2022 में भी सलीम खान ने बांद्रा पुलिस स्टेशन में एक शिकायत दर्ज करवाई थी। उन्हें एक चिट्ठी मिली थी, जिसमें सलमान और उनके परिवार को धमकी दी गई थी। ये खबरें भी पढ़ें... सलमान के घर फायरिंग करने वालों को दाऊद का डर:आरोपी विक्की और सागर का दावा- सलमान के गैंगस्टर्स से संबंध, वो हमें मरवाना चाहते हैं सलमान खान के घर पर फायरिंग करने के आरोप में जेल में बंद विक्की गुप्ता और सागर पाल को अपनी हत्या का डर सता रहा है। न्यूज एजेंसी ANI को आरोपियों के वकील ने बताया कि दोनों ने जेल अधिकारियों से इसकी शिकायत की है। उनके परिवार वालों ने महाराष्ट्र और बिहार सरकार से शिकायत करके सुरक्षा की मांग की है। पूरी खबर पढ़ें... पुलिस का दावा- सलमान की सुपारी दी गई थी:₹25 लाख में डील हुई, पाकिस्तान से AK-47 आनी थी, चार्जशीट में 5 आरोपियों के नाम एक्टर सलमान खान के घर हुई फायरिंग की जांच कर रही नवी मुंबई पुलिस ने नया खुलासा किया है। पुलिस का कहना है कि लॉरेंस गैंग ने सलमान को मारने के लिए 25 लाख रुपए की सुपारी दी थी। पूरी खबर यहां पढ़ें...""}","Thu, 19 Sep 2024 06:07:18 +0000","time.struct_time(tm_year=2024, tm_mon=9, tm_mday=19, tm_hour=6, tm_min=7, tm_sec=18, tm_wday=3, tm_yday=263, tm_isdst=0)","[{'url': 'https://images.bhaskarassets.com/thumb/1000x1000/web2images/521/2024/09/19/s1-9_1726735773.gif', 'type': 'image/gif', 'width': '1000', 'height': '1000'}]",Dainik Bhaskar,Maharashtra,,,,2024-10-04 11:13:10.539244
