title,title_detail,links,link,id,guidislink,summary,summary_detail,published,published_parsed,media_content,Name,Section,Language,Twitter_URL,FB_URL,Fetched_At
"बैंक की छत पर नकली पिस्टल लेकर चढ़े 8 लड़के:रील्स बनाने गए, लोगों ने समझा लूट के लिए आए; किशनगंज पुलिस पहुंची","{'type': 'text/plain', 'language': None, 'base': 'https://www.bhaskar.com/rss-v1--category-3679.xml', 'value': 'बैंक की छत पर नकली पिस्टल लेकर चढ़े 8 लड़के:रील्स\xa0बनाने गए, लोगों ने समझा लूट के लिए आए; किशनगंज\xa0पुलिस पहुंची'}","[{'rel': 'alternate', 'type': 'text/html', 'href': 'https://www.bhaskar.com/local/bihar/kishanganj/news/8-boys-climbed-onto-the-roof-of-a-bank-with-a-fake-pistol-in-kishanganj-133748828.html'}, {'href': 'https://www.bhaskar.com/local/bihar/kishanganj/news/8-boys-climbed-onto-the-roof-of-a-bank-with-a-fake-pistol-in-kishanganj-133748828.html', 'rel': 'alternate', 'type': 'text/html'}]",https://www.bhaskar.com/local/bihar/kishanganj/news/8-boys-climbed-onto-the-roof-of-a-bank-with-a-fake-pistol-in-kishanganj-133748828.html,https://www.bhaskar.com/local/bihar/kishanganj/news/8-boys-climbed-onto-the-roof-of-a-bank-with-a-fake-pistol-in-kishanganj-133748828.html,False,"किशनगंज शहर का हार्ट कहलाने वाले गांधी चौक पर गुरुवार की शाम कोहराम मच गया। एक शख्स ने कॉल कर पुलिस से कहा कि यहां स्थित बैंक की बिल्डिंग की छत पर 8 लोग हथियार के साथ घूम रहे हैं। बिल्डिंग में नीचे पंजाब नेशनल बैंक, देना बैंक और बाटा का शोरूम भी है। मामले को गंभीरता से लेते हुए पुलिस तुरंत मौके पर पहुंची और आठों को पकड़कर थाना ले गई। पुलिस के मुताबिक घटना शुक्रवार की शाम करीब चार बजे की है। सभी नाबालिग लड़के की उम्र 14 से 16 साल है। लोगों के मुताबिक सभी छत पर रील्स बनाने के लिए जुटे थे। उनके हाथ में नकली पिस्टल, लाइटर जैसे अन्य सामान मिले हैं। बताया गया कि सदर थानाध्यक्ष संदीप कुमार के नेतृत्व में पुलिस की टीम वहां पहुंची थी। थोड़ी देर बाद मुख्यालय डीएसपी अशोक कुमार भी पहुंचे। इसके बाद पूरे भवन की तलाशी ली गई। तलाशी के दौरान भवन की छत पर आठ नाबालिग लड़के संदिग्ध अवस्था में मिले। पुलिस की टीम ने सभी को पकड़ा। उनके पास से लाइटर जैसा नकली पिस्टल बरामद किया गया है। सभी लड़कों से पूछताछ की जा रही है। पूछताछ के बाद ही स्थिति पूरी तरह से स्पष्ट हो पाएगी। एसपी सागर कुमार ने बताया कि गांधी चौक के पास एक बैंक की बिल्डिंग में कुछ लड़कों के हथियार के साथ प्रवेश करने की सूचना मिली थी। उनके पास से एक नकली पिस्टल जैसा वस्तु बरामद किया गया है। फोन पर एसपी सागर कुमार ने बताया कि बच्चे रील बनाने के उद्देश्य से बैंक की छत पर चढ़े थे। टाउन थाना पुलिस को सूचना मिली कि पंजाब नेशनल बैंक के छत के ऊपर कुछ गतिविधि हो रही है। इस गतिविधि को देखते हुए टाउन थाना पुलिस घटनास्थल पर पहुंची। मौके पर लोगों की भीड़ जुट गई है। लगभग एक घंटे तक पुलिस की कार्रवाई चली। वहीं, जिस भवन में लड़के संदिग्ध अवस्था में घूम रहे थे, उस भवन के ठीक सामने एसबीआई का मेन ब्रांच भी है।","{'type': 'text/html', 'language': None, 'base': 'https://www.bhaskar.com/rss-v1--category-3679.xml', 'value': 'किशनगंज शहर का हार्ट कहलाने वाले गांधी चौक पर गुरुवार की शाम कोहराम मच गया। एक शख्स ने कॉल कर पुलिस से कहा कि यहां स्थित बैंक की बिल्डिंग की छत पर 8 लोग हथियार के साथ घूम रहे हैं। बिल्डिंग में नीचे पंजाब नेशनल बैंक, देना बैंक और बाटा का शोरूम भी है। मामले को गंभीरता से लेते हुए पुलिस तुरंत मौके पर पहुंची और आठों को पकड़कर थाना ले गई। पुलिस के मुताबिक घटना शुक्रवार की शाम करीब चार बजे की है। सभी नाबालिग लड़के की उम्र 14 से 16 साल है। लोगों के मुताबिक सभी छत पर रील्स बनाने के लिए जुटे थे। उनके हाथ में नकली पिस्टल, लाइटर जैसे अन्य सामान मिले हैं। बताया गया कि सदर थानाध्यक्ष संदीप कुमार के नेतृत्व में पुलिस की टीम वहां पहुंची थी। थोड़ी देर बाद मुख्यालय डीएसपी अशोक कुमार भी पहुंचे। इसके बाद पूरे भवन की तलाशी ली गई। तलाशी के दौरान भवन की छत पर आठ नाबालिग लड़के संदिग्ध अवस्था में मिले। पुलिस की टीम ने सभी को पकड़ा। उनके पास से लाइटर जैसा नकली पिस्टल बरामद किया गया है। सभी लड़कों से पूछताछ की जा रही है। पूछताछ के बाद ही स्थिति पूरी तरह से स्पष्ट हो पाएगी। एसपी सागर कुमार ने बताया कि गांधी चौक के पास एक बैंक की बिल्डिंग में कुछ लड़कों के हथियार के साथ प्रवेश करने की सूचना मिली थी। उनके पास से एक नकली पिस्टल जैसा वस्तु बरामद किया गया है। फोन पर एसपी सागर कुमार ने बताया कि बच्चे रील बनाने के उद्देश्य से बैंक की छत पर चढ़े थे। टाउन थाना पुलिस को सूचना मिली कि पंजाब नेशनल बैंक के छत के ऊपर कुछ गतिविधि हो रही है। इस गतिविधि को देखते हुए टाउन थाना पुलिस घटनास्थल पर पहुंची। मौके पर लोगों की भीड़ जुट गई है। लगभग एक घंटे तक पुलिस की कार्रवाई चली। वहीं, जिस भवन में लड़के संदिग्ध अवस्था में घूम रहे थे, उस भवन के ठीक सामने एसबीआई का मेन ब्रांच भी है।'}","Fri, 04 Oct 2024 12:52:48 +0000","time.struct_time(tm_year=2024, tm_mon=10, tm_mday=4, tm_hour=12, tm_min=52, tm_sec=48, tm_wday=4, tm_yday=278, tm_isdst=0)","[{'url': 'https://images.bhaskarassets.com/thumb/1000x1000/web2images/521/2024/10/04/28_1728046826.gif', 'type': 'image/gif', 'width': '1000', 'height': '1000'}]",Dainik Bhaskar,Bihar,,,,2024-10-04 11:13:07.289895
"बिहार इवनिंग बुलेटिन:इंडो-नेपाल बॉर्डर पर जवानों से मारपीट, विधायक ने बांटी तलवार, तेजस्वी बोले-बेबस हैं JDU सांसद; VIDEO में बिहार की 10 बड़ी खबरें","{'type': 'text/plain', 'language': None, 'base': 'https://www.bhaskar.com/rss-v1--category-3679.xml', 'value': 'बिहार इवनिंग बुलेटिन:इंडो-नेपाल बॉर्डर पर जवानों से मारपीट, विधायक ने बांटी तलवार, तेजस्वी बोले-बेबस हैं JDU सांसद; VIDEO में बिहार की 10 बड़ी खबरें'}","[{'rel': 'alternate', 'type': 'text/html', 'href': 'https://www.bhaskar.com/local/bihar/news/bihar-evening-bulletin-news-tejashwi-yadav-vs-jdu-flood-victims-133748954.html'}, {'href': 'https://www.bhaskar.com/local/bihar/news/bihar-evening-bulletin-news-tejashwi-yadav-vs-jdu-flood-victims-133748954.html', 'rel': 'alternate', 'type': 'text/html'}]",https://www.bhaskar.com/local/bihar/news/bihar-evening-bulletin-news-tejashwi-yadav-vs-jdu-flood-victims-133748954.html,https://www.bhaskar.com/local/bihar/news/bihar-evening-bulletin-news-tejashwi-yadav-vs-jdu-flood-victims-133748954.html,False,इवनिंग न्यूज बुलेटिन में बिहार की दिनभर की 10 बड़ी खबरें देखने के लिए ऊपर फोटो पर क्लिक करें…,"{'type': 'text/html', 'language': None, 'base': 'https://www.bhaskar.com/rss-v1--category-3679.xml', 'value': 'इवनिंग न्यूज बुलेटिन में बिहार की दिनभर की 10 बड़ी खबरें देखने के लिए ऊपर फोटो पर क्लिक करें…'}","Fri, 04 Oct 2024 13:23:10 +0000","time.struct_time(tm_year=2024, tm_mon=10, tm_mday=4, tm_hour=13, tm_min=23, tm_sec=10, tm_wday=4, tm_yday=278, tm_isdst=0)","[{'url': 'https://images.bhaskarassets.com/thumb/1000x1000/web2images/521/2024/10/04/24-3_1728046032.gif', 'type': 'image/gif', 'width': '1000', 'height': '1000'}]",Dainik Bhaskar,Bihar,,,,2024-10-04 11:13:07.289895
"छात्रा ने काटी नस, टीचर पर यौन शोषण का आरोप:बेतिया में चल रहा इलाज, आरोपी फरार, पुलिस कर रही खोज","{'type': 'text/plain', 'language': None, 'base': 'https://www.bhaskar.com/rss-v1--category-3679.xml', 'value': 'छात्रा ने काटी नस, टीचर पर यौन शोषण का आरोप:बेतिया में चल रहा इलाज, आरोपी फरार, पुलिस कर रही खोज'}","[{'rel': 'alternate', 'type': 'text/html', 'href': 'https://www.bhaskar.com/local/bihar/bettiah/news/student-cuts-vein-accuses-teacher-of-sexual-abuse-133748868.html'}, {'href': 'https://www.bhaskar.com/local/bihar/bettiah/news/student-cuts-vein-accuses-teacher-of-sexual-abuse-133748868.html', 'rel': 'alternate', 'type': 'text/html'}]",https://www.bhaskar.com/local/bihar/bettiah/news/student-cuts-vein-accuses-teacher-of-sexual-abuse-133748868.html,https://www.bhaskar.com/local/bihar/bettiah/news/student-cuts-vein-accuses-teacher-of-sexual-abuse-133748868.html,False,बेतिया में एक शिक्षक ने छात्रा को शादी का झांसा देकर एक साल तक उसका यौन शोषण किया और अब शादी करने से इनकार कर दिया। इस बात से नाराज होकर युवती ने ब्लेड से अपने हाथ का नस काट लिया। परिजनों ने उसे आनन-फानन में इलाज के लिए सामुदायिक स्वास्थ्य केंद्र लौरिया में भर्ती कराया है। जहां उसका इलाज चल रहा है। मामला लौरिया थाना क्षेत्र के गांव का है। वहीं घटना की सूचना पर पहुंची पुलिस ने पीड़िता का बायन दर्ज कर मामले की जांच पड़ताल शुरू कर दी है। पीड़िता के पिता ने पुलिस को बताया है कि उसकी बेटी गांव के ही एक कोचिंग में पढ़ने जाती है। इस दौरान शिक्षक निरंजन कुमार राम उसे शादी का झांसा देकर करीब एक साल तक उसका यौन शोषण किया। जब शादी की बात आई तो इनकार कर दिया। इस बात से परेशान होकर उसने अपने हाथ के नस को काट लिया। इधर घटना के बाद शिक्षक कोचिंग बंद करके फरार है। थानाध्यक्ष संतोष कुमार शर्मा ने कहा कि एक युवती के साथ शादी का झांसा देकर यौन शोषण करने का मामला सामने आया है। पुलिस मामले की जांच पड़ताल में जुटी हुई है। पीड़िता ने अपने हाथ का नस काट लिया है। उसका इलाज चल रहा है। मामले में एफआईआर दर्ज कर आरोपी शिक्षक को गिरफ्तार किया जाएगा।,"{'type': 'text/html', 'language': None, 'base': 'https://www.bhaskar.com/rss-v1--category-3679.xml', 'value': 'बेतिया में एक शिक्षक ने छात्रा को शादी का झांसा देकर एक साल तक उसका यौन शोषण किया और अब शादी करने से इनकार कर दिया। इस बात से नाराज होकर युवती ने ब्लेड से अपने हाथ का नस काट लिया। परिजनों ने उसे आनन-फानन में इलाज के लिए सामुदायिक स्वास्थ्य केंद्र लौरिया में भर्ती कराया है। जहां उसका इलाज चल रहा है। मामला लौरिया थाना क्षेत्र के गांव का है। वहीं घटना की सूचना पर पहुंची पुलिस ने पीड़िता का बायन दर्ज कर मामले की जांच पड़ताल शुरू कर दी है। पीड़िता के पिता ने पुलिस को बताया है कि उसकी बेटी गांव के ही एक कोचिंग में पढ़ने जाती है। इस दौरान शिक्षक निरंजन कुमार राम उसे शादी का झांसा देकर करीब एक साल तक उसका यौन शोषण किया। जब शादी की बात आई तो इनकार कर दिया। इस बात से परेशान होकर उसने अपने हाथ के नस को काट लिया। इधर घटना के बाद शिक्षक कोचिंग बंद करके फरार है। थानाध्यक्ष संतोष कुमार शर्मा ने कहा कि एक युवती के साथ शादी का झांसा देकर यौन शोषण करने का मामला सामने आया है। पुलिस मामले की जांच पड़ताल में जुटी हुई है। पीड़िता ने अपने हाथ का नस काट लिया है। उसका इलाज चल रहा है। मामले में एफआईआर दर्ज कर आरोपी शिक्षक को गिरफ्तार किया जाएगा।'}","Fri, 04 Oct 2024 13:01:55 +0000","time.struct_time(tm_year=2024, tm_mon=10, tm_mday=4, tm_hour=13, tm_min=1, tm_sec=55, tm_wday=4, tm_yday=278, tm_isdst=0)","[{'url': 'https://images.bhaskarassets.com/thumb/1000x1000/web2images/521/2024/10/04/63bb4f0d-fcb7-4867-96f2-0d59edb5c56c_1728039035221.jpg', 'type': 'image/jpeg', 'width': '1000', 'height': '1000'}]",Dainik Bhaskar,Bihar,,,,2024-10-04 11:13:07.289895
"देसी कट्टा से केक काटने पर 2 युवक गिरफ्तार:छपरा में दोस्तों के साथ मना रहे थे बर्थडे, पुलिस ने हथियार किया जब्त","{'type': 'text/plain', 'language': None, 'base': 'https://www.bhaskar.com/rss-v1--category-3679.xml', 'value': 'देसी कट्टा से केक काटने पर 2 युवक गिरफ्तार:छपरा में दोस्तों के साथ मना रहे थे बर्थडे, पुलिस ने हथियार किया जब्त'}","[{'rel': 'alternate', 'type': 'text/html', 'href': 'https://www.bhaskar.com/local/bihar/saran/chhapra/news/2-youths-arrested-for-cutting-cake-with-desi-gun-133749103.html'}, {'href': 'https://www.bhaskar.com/local/bihar/saran/chhapra/news/2-youths-arrested-for-cutting-cake-with-desi-gun-133749103.html', 'rel': 'alternate', 'type': 'text/html'}]",https://www.bhaskar.com/local/bihar/saran/chhapra/news/2-youths-arrested-for-cutting-cake-with-desi-gun-133749103.html,https://www.bhaskar.com/local/bihar/saran/chhapra/news/2-youths-arrested-for-cutting-cake-with-desi-gun-133749103.html,False,छपरा में देसी कट्टा के साथ बर्थडे केक काटना एक युवक को महंगा पड़ गया। पुलिस ने वीडियो फोटो के आधार पर कार्रवाई करते हुए दो युवकों को गिरफ्तार कर लिया है। गिरफ्तार युवकों की पहचान दाऊदपुर थाना क्षेत्र के लहमारी गांव निवासी मुन्ना अंसारी पिता नसीम अंसारी और निशाद अंसारी पिता सनउर अंसारी के रूप में हुई है। दोनों युवकों अपने अन्य दोस्तों के साथ एकमा थाना क्षेत्र के छितरवालिया गांव के बगीचे में देसी कट्टा के साथ केक काटकर बर्थडे मना रहे थे। इसकी जानकारी स्थानीय लोगों ने एकमा थाने की पुलिस को दी।थानाध्यक्ष ने कार्रवाई करते हुए दोनों युवकों को गिरफ्तार कर लिया और अन्य युवकों की गिरफ्तारी के लिए छापेमारी की जा रही है। एसपी कुमार आशीष ने प्रेस रिलीज जारी करते हुए बताया कि एकमा थाना की ओर से गुप्त सूचना पर 2 युवकों को हथियार के साथ पकड़ा है। छितरबलिया बगीचा स्थित राजीव सिंह के पोखर के पास दोनों युवक देसी कट्टा के साथ केक काट रहे थे। मामले को लेकर एकमा थाना में कांड दर्ज कर आगे की कार्रवाई की जा रही है।,"{'type': 'text/html', 'language': None, 'base': 'https://www.bhaskar.com/rss-v1--category-3679.xml', 'value': 'छपरा में देसी कट्टा के साथ बर्थडे केक काटना एक युवक को महंगा पड़ गया। पुलिस ने वीडियो फोटो के आधार पर कार्रवाई करते हुए दो युवकों को गिरफ्तार कर लिया है। गिरफ्तार युवकों की पहचान दाऊदपुर थाना क्षेत्र के लहमारी गांव निवासी मुन्ना अंसारी पिता नसीम अंसारी और निशाद अंसारी पिता सनउर अंसारी के रूप में हुई है। दोनों युवकों अपने अन्य दोस्तों के साथ एकमा थाना क्षेत्र के छितरवालिया गांव के बगीचे में देसी कट्टा के साथ केक काटकर बर्थडे मना रहे थे। इसकी जानकारी स्थानीय लोगों ने एकमा थाने की पुलिस को दी।थानाध्यक्ष ने कार्रवाई करते हुए दोनों युवकों को गिरफ्तार कर लिया और अन्य युवकों की गिरफ्तारी के लिए छापेमारी की जा रही है। एसपी कुमार आशीष ने प्रेस रिलीज जारी करते हुए बताया कि एकमा थाना की ओर से गुप्त सूचना पर 2 युवकों को हथियार के साथ पकड़ा है। छितरबलिया बगीचा स्थित राजीव सिंह के पोखर के पास दोनों युवक देसी कट्टा के साथ केक काट रहे थे। मामले को लेकर एकमा थाना में कांड दर्ज कर आगे की कार्रवाई की जा रही है।'}","Fri, 04 Oct 2024 14:01:01 +0000","time.struct_time(tm_year=2024, tm_mon=10, tm_mday=4, tm_hour=14, tm_min=1, tm_sec=1, tm_wday=4, tm_yday=278, tm_isdst=0)","[{'url': 'https://images.bhaskarassets.com/thumb/1000x1000/web2images/521/2024/10/04/f4e54803-0a9b-4125-857b-b60f846d56b7_1728042018190.jpg', 'type': 'image/jpeg', 'width': '1000', 'height': '1000'}]",Dainik Bhaskar,Bihar,,,,2024-10-04 11:13:07.289895
