title,title_detail,links,link,id,guidislink,summary,summary_detail,published,published_parsed,media_content,Name,Section,Language,Twitter_URL,FB_URL,Fetched_At
महाराष्ट्र विधानसभा के डिप्टी स्पीकर मंत्रालय की बिल्डिंग से कूदे:तीसरी मंजिल से छलांग लगाई; नीचे जाल रहने के कारण जान बची,"{'type': 'text/plain', 'language': None, 'base': 'https://www.bhaskar.com/rss-v1--category-2318.xml', 'value': 'महाराष्ट्र विधानसभा के डिप्टी स्पीकर मंत्रालय की बिल्डिंग से कूदे:तीसरी मंजिल से छलांग लगाई; नीचे जाल रहने के कारण जान बची'}","[{'rel': 'alternate', 'type': 'text/html', 'href': 'https://www.bhaskar.com/national/news/maharashtra-mantralaya-building-deputy-speaker-narhari-zirwal-133747688.html'}, {'href': 'https://www.bhaskar.com/national/news/maharashtra-mantralaya-building-deputy-speaker-narhari-zirwal-133747688.html', 'rel': 'alternate', 'type': 'text/html'}]",https://www.bhaskar.com/national/news/maharashtra-mantralaya-building-deputy-speaker-narhari-zirwal-133747688.html,https://www.bhaskar.com/national/news/maharashtra-mantralaya-building-deputy-speaker-narhari-zirwal-133747688.html,False,"महाराष्ट्र विधानसभा के डिप्टी स्पीकर नरहरी झिरवल ने शुक्रवार को मंत्रालय की तीसरी मंजिल से छलांग लगा दी। उनके साथ विधायक हिरामन खोसकर भी कूद पड़े। हालांकि, नीचे जाल रहने के कारण उनकी जान बच गई। दोनों ​​​​​​आदिवासी विधायक जाल में फंस गए थे। मौके पर पहुंची पुलिस ने उन्हें बाहर निकाला। ऊंचाई से गिरने के कारण झिरवल की गर्दन पर चोट आई है। उनका ब्लड प्रेशर भी बढ़ गया है। उनकी जांच के लिए डॉक्टरों की एक टीम मंत्रालय पहुंची। झिरवल धनगर समाज को ST दर्जा देने के खिलाफ
झिरवल उपमुख्यमंत्री अजीत पवार की NCP गुट के विधायक हैं। वे धनगर समाज को ST का दर्जा देने की मांग पर सरकार के विचार करने के फैसले का विरोध कर रहे हैं। जबकि, झिरवल खुद शिंदे सरकार का हिस्सा हैं इस मामले को लेकर झिरवल और अन्य आदिवासी विधायकों ने शुक्रवार, 4 अक्टूबर को मुख्यमंत्री एकनाथ शिंदे से मुलाकात की थी। हालांकि, जब बात नहीं बनी तो उन्होंने मंत्रालय की तीसरी मंजिल से छलांग लगा दी। झिरवल और खोसकर ने आदिवासी समुदाय के समर्थन में नारे भी लगाए। घटना के बाद मंत्रालय में कामकाज ठप पड़ गया। झिरवल ने CM से मुलाकात से पहले कहा था- प्लान बी तैयार है
नरहरि झिरवल ने मुख्यमंत्री शिंदे ​​​​​​से मुलाकात से पहले चेतावनी दी थी। उन्होंने कहा था कि CM हमारी बात नहीं सुनेंगे तो हमारे पास प्लान बी तैयार है। झिरवल ने कहा कि हम ST आरक्षण को प्रभावित नहीं होने देना चाहते हैं। इसके बाद एक घंटे के अंदर उन्होंने मंत्रालय की तीसरी मंजिल से छलांग लगाकर अपना गुस्सा जाहिर किया। धनगर कम्युनिटी को OBC का दर्जा, ST रिजर्वेशन की मांग कर रहे
महाराष्ट्र में धनगर समुदाय चरवाहा कम्यूनिटी में आते हैं। उन्हें अभी OBC का दर्जा प्राप्त है। धनगरों को घुमंतू जनजाति (NT) कैटेगरी के तहत शिक्षा और नौकरियों में 3.5% आरक्षण मिलता है। दूसरी ओर, देश के अन्य हिस्सों में धंनगड़, जिन्हें ओरांव, धनका और डोम के नाम से भी जाना जाता है। उन्हें अनुसूचित जनजाति (ST) का दर्जा प्राप्त है। धनगर समुदाय मध्य प्रदेश, बिहार, तेलंगाना, गोवा और कर्नाटक में फैला हुआ है। महाराष्ट्र का धनगर समुदाय सालों से दावा करता रहा है कि धनगड़ और धनगर एक ही हैं। सिर्फ स्पेलिंग का फर्क हैं। वे खुद को अनुसूचित जनजाति (ST) में शामिल करने और 7% आरक्षण देने की मांग कर रहे हैं। महाराष्ट्र में धनगर समुदाय की आबादी लगभग 1.5 करोड़ है, जो राज्य की कुल आबादी का लगभग 13% है। धनगर समुदाय के लोग मराठों के बाद महाराष्ट्र का दूसरा सबसे बड़ा समुदाय होने का दावा करते हैं। पश्चिमी महाराष्ट्र में 25-30 विधानसभा सीटों पर उनका प्रभाव है। फडणवीस ने 2013 में ST रिजर्वेशन देने का वादा किया था
महाराष्ट्र में धनगर आरक्षण की मांग का मुद्दा आजादी के बाद से कई बार उठा। मामला अदालत तक पहुंचा। सुप्रीम कोर्ट और बॉम्बे हाई कोर्ट ने इस मामले में धनगर समुदाय की याचिकाओं को खारिज कर दिया था। राज्य में 2013 में सबसे बड़ा धनगर आंदोलन देखा गया। तब विपक्ष के नेता और मौजूदा डिप्टी सीएम देवेंद्र फडणवीस बारामती में प्रदर्शनकारियों से लिखित में वादा किया था कि अगर वे सत्ता में आए तो पहली कैबिनेट बैठक में धनगर आरक्षण को मंजूरी दे देंगे। समुदाय का कहना है कि उस साल उन्होंने भाजपा-शिवसेना सरकार को वोट दिया था, लेकिन सत्ता में आने के बाद उन्होंने अपना वादा पूरा नहीं किया। कुछ हफ्ते पहले, धनगर समुदाय के एक प्रतिनिधिमंडल ने मुख्यमंत्री एकनाथ शिंदे से मुलाकात की थी। तब सीएम ने कहा था कि राज्य सरकार आरक्षण को लेकर दूसरे समुदायों को नाराज किए बिना धनगरों की मांगों पर विचार करेगी। मंत्री शंभुराज देसाई ने कहा था कि सरकार धनगरों को ST का दर्जा देने के लिए एक सरकारी प्रस्ताव जारी करने पर विचार करेगी। तब से, आदिवासी समुदाय ने इसका विरोध कर रहे हैं। महाराष्ट्र में आरक्षण को लेकर विवाद से जुड़ी ये खबरें भी पढ़ें... जरांगे ने फडणवीस को मराठा आरक्षण में रुकावट बताया, डिप्टी CM बोले- अगर CM शिंदे ऐसा कहते हैं तो मैं राजनीति छोड़ दूंगा महाराष्ट्र में मनोज जरांगे मराठा आरक्षण की मांग कर रहे हैं। जरांगे लगातार डिप्टी सीएम देवेंद्र फडणवीस पर मराठा आरक्षण देने में रुकावट डालने का आरोप लगा रहे हैं। इसपर फडणवीस ने कहा कि अगर सीएम एकनाथ शिंदे मुझे आरक्षण में बाधा मानते हैं तो मैं राजनीति छोड़ दूंगा। पूरी खबर पढ़ें... शिवसेना विधायक संजय गायकवाड़ पर FIR: कहा था- राहुल गांधी की जीभ काट लाओ; आरक्षण पर कांग्रेस नेता के बयान से नाराजगीट महाराष्ट्र के बुलढाणा से विधायक संजय गायकवाड़ के खिलाफ FIR दर्ज की गई। उन्होंने कहा था कि राहुल गांधी पिछड़ों, आदिवासियों का आरक्षण खत्म करना चाहते हैं। उन्हें इसका इनाम मिलेगा, जो भी राहुल की जीभ काटेगा, उसे 11 लाख रुपए दिए जाएंगे। गायकवाड़ ने अमेरिका में आरक्षण पर राहुल के बयान पर ये प्रतिक्रिया दी थी। पूरी खबर पढ़ें...","{'type': 'text/html', 'language': None, 'base': 'https://www.bhaskar.com/rss-v1--category-2318.xml', 'value': 'महाराष्ट्र विधानसभा के डिप्टी स्पीकर नरहरी झिरवल ने शुक्रवार को मंत्रालय की तीसरी मंजिल से छलांग लगा दी। उनके साथ विधायक हिरामन खोसकर भी कूद पड़े। हालांकि, नीचे जाल रहने के कारण उनकी जान बच गई। दोनों \u200b\u200b\u200b\u200b\u200b\u200bआदिवासी विधायक जाल में फंस गए थे। मौके पर पहुंची पुलिस ने उन्हें बाहर निकाला। ऊंचाई से गिरने के कारण झिरवल की गर्दन पर चोट आई है। उनका ब्लड प्रेशर भी बढ़ गया है। उनकी जांच के लिए डॉक्टरों की एक टीम मंत्रालय पहुंची। झिरवल धनगर समाज को ST दर्जा देने के खिलाफ\nझिरवल उपमुख्यमंत्री अजीत पवार की NCP गुट के विधायक हैं। वे धनगर समाज को ST का दर्जा देने की मांग पर सरकार के विचार करने के फैसले का विरोध कर रहे हैं। जबकि, झिरवल खुद शिंदे सरकार का हिस्सा हैं इस मामले को लेकर झिरवल और अन्य आदिवासी विधायकों ने शुक्रवार, 4 अक्टूबर को मुख्यमंत्री एकनाथ शिंदे से मुलाकात की थी। हालांकि, जब बात नहीं बनी तो उन्होंने मंत्रालय की तीसरी मंजिल से छलांग लगा दी। झिरवल और खोसकर ने आदिवासी समुदाय के समर्थन में नारे भी लगाए। घटना के बाद मंत्रालय में कामकाज ठप पड़ गया। झिरवल ने CM से मुलाकात से पहले कहा था- प्लान बी तैयार है\nनरहरि झिरवल ने मुख्यमंत्री शिंदे \u200b\u200b\u200b\u200b\u200b\u200bसे मुलाकात से पहले चेतावनी दी थी। उन्होंने कहा था कि CM हमारी बात नहीं सुनेंगे तो हमारे पास प्लान बी तैयार है। झिरवल ने कहा कि हम ST आरक्षण को प्रभावित नहीं होने देना चाहते हैं। इसके बाद एक घंटे के अंदर उन्होंने मंत्रालय की तीसरी मंजिल से छलांग लगाकर अपना गुस्सा जाहिर किया। धनगर कम्युनिटी को OBC का दर्जा, ST रिजर्वेशन की मांग कर रहे\nमहाराष्ट्र में धनगर समुदाय चरवाहा कम्यूनिटी में आते हैं। उन्हें अभी OBC का दर्जा प्राप्त है। धनगरों को घुमंतू जनजाति (NT) कैटेगरी के तहत शिक्षा और नौकरियों में 3.5% आरक्षण मिलता है। दूसरी ओर, देश के अन्य हिस्सों में धंनगड़, जिन्हें ओरांव, धनका और डोम के नाम से भी जाना जाता है। उन्हें अनुसूचित जनजाति (ST) का दर्जा प्राप्त है। धनगर समुदाय मध्य प्रदेश, बिहार, तेलंगाना, गोवा और कर्नाटक में फैला हुआ है। महाराष्ट्र का धनगर समुदाय सालों से दावा करता रहा है कि धनगड़ और धनगर एक ही हैं। सिर्फ स्पेलिंग का फर्क हैं। वे खुद को अनुसूचित जनजाति (ST) में शामिल करने और 7% आरक्षण देने की मांग कर रहे हैं। महाराष्ट्र में धनगर समुदाय की आबादी लगभग 1.5 करोड़ है, जो राज्य की कुल आबादी का लगभग 13% है। धनगर समुदाय के लोग मराठों के बाद महाराष्ट्र का दूसरा सबसे बड़ा समुदाय होने का दावा करते हैं। पश्चिमी महाराष्ट्र में 25-30 विधानसभा सीटों पर उनका प्रभाव है। फडणवीस ने 2013 में ST रिजर्वेशन देने का वादा किया था\nमहाराष्ट्र में धनगर आरक्षण की मांग का मुद्दा आजादी के बाद से कई बार उठा। मामला अदालत तक पहुंचा। सुप्रीम कोर्ट और बॉम्बे हाई कोर्ट ने इस मामले में धनगर समुदाय की याचिकाओं को खारिज कर दिया था। राज्य में 2013 में सबसे बड़ा धनगर आंदोलन देखा गया। तब विपक्ष के नेता और मौजूदा डिप्टी सीएम देवेंद्र फडणवीस बारामती में प्रदर्शनकारियों से लिखित में वादा किया था कि अगर वे सत्ता में आए तो पहली कैबिनेट बैठक में धनगर आरक्षण को मंजूरी दे देंगे। समुदाय का कहना है कि उस साल उन्होंने भाजपा-शिवसेना सरकार को वोट दिया था, लेकिन सत्ता में आने के बाद उन्होंने अपना वादा पूरा नहीं किया। कुछ हफ्ते पहले, धनगर समुदाय के एक प्रतिनिधिमंडल ने मुख्यमंत्री एकनाथ शिंदे से मुलाकात की थी। तब सीएम ने कहा था कि राज्य सरकार आरक्षण को लेकर दूसरे समुदायों को नाराज किए बिना धनगरों की मांगों पर विचार करेगी। मंत्री शंभुराज देसाई ने कहा था कि सरकार धनगरों को ST का दर्जा देने के लिए एक सरकारी प्रस्ताव जारी करने पर विचार करेगी। तब से, आदिवासी समुदाय ने इसका विरोध कर रहे हैं। महाराष्ट्र में आरक्षण को लेकर विवाद से जुड़ी ये खबरें भी पढ़ें... जरांगे ने फडणवीस को मराठा आरक्षण में रुकावट बताया, डिप्टी CM बोले- अगर CM शिंदे ऐसा कहते हैं तो मैं राजनीति छोड़ दूंगा महाराष्ट्र में मनोज जरांगे मराठा आरक्षण की मांग कर रहे हैं। जरांगे लगातार डिप्टी सीएम देवेंद्र फडणवीस पर मराठा आरक्षण देने में रुकावट डालने का आरोप लगा रहे हैं। इसपर फडणवीस ने कहा कि अगर सीएम एकनाथ शिंदे मुझे आरक्षण में बाधा मानते हैं तो मैं राजनीति छोड़ दूंगा। पूरी खबर पढ़ें... शिवसेना विधायक संजय गायकवाड़ पर FIR: कहा था- राहुल गांधी की जीभ काट लाओ; आरक्षण पर कांग्रेस नेता के बयान से नाराजगीट महाराष्ट्र के बुलढाणा से विधायक संजय गायकवाड़ के खिलाफ FIR दर्ज की गई। उन्होंने कहा था कि राहुल गांधी पिछड़ों, आदिवासियों का आरक्षण खत्म करना चाहते हैं। उन्हें इसका इनाम मिलेगा, जो भी राहुल की जीभ काटेगा, उसे 11 लाख रुपए दिए जाएंगे। गायकवाड़ ने अमेरिका में आरक्षण पर राहुल के बयान पर ये प्रतिक्रिया दी थी। पूरी खबर पढ़ें...'}","Fri, 04 Oct 2024 07:40:03 +0000","time.struct_time(tm_year=2024, tm_mon=10, tm_mday=4, tm_hour=7, tm_min=40, tm_sec=3, tm_wday=4, tm_yday=278, tm_isdst=0)","[{'url': 'https://images.bhaskarassets.com/thumb/1000x1000/web2images/521/2024/10/04/gifs24_1728027324.gif', 'type': 'image/gif', 'width': '1000', 'height': '1000'}]",Dainik Bhaskar,Maharashtra,,,,2024-10-04 11:13:10.539244
