title,title_detail,links,link,id,guidislink,summary,summary_detail,published,published_parsed,media_content,Name,Section,Language,Twitter_URL,FB_URL,Fetched_At
"बदलापुर एनकाउंटर- पिता हाईकोर्ट पहुंचे, SIT की मांग:परिवार का आरोप- कस्टडी में पीटा गया; विपक्ष का सवाल- हथकड़ी में फायरिंग कैसे की","{'type': 'text/plain', 'language': None, 'base': 'https://www.bhaskar.com/rss-v1--category-2318.xml', 'value': 'बदलापुर एनकाउंटर- पिता हाईकोर्ट पहुंचे, SIT की मांग:परिवार का आरोप- कस्टडी में पीटा गया; विपक्ष का सवाल- हथकड़ी में फायरिंग कैसे की'}","[{'rel': 'alternate', 'type': 'text/html', 'href': 'https://www.bhaskar.com/national/news/badlapur-rape-case-accused-died-in-firing-kin-claimed-police-encounter-133691486.html'}, {'href': 'https://www.bhaskar.com/national/news/badlapur-rape-case-accused-died-in-firing-kin-claimed-police-encounter-133691486.html', 'rel': 'alternate', 'type': 'text/html'}]",https://www.bhaskar.com/national/news/badlapur-rape-case-accused-died-in-firing-kin-claimed-police-encounter-133691486.html,https://www.bhaskar.com/national/news/badlapur-rape-case-accused-died-in-firing-kin-claimed-police-encounter-133691486.html,False,"बदलापुर दुष्कर्म केस में आरोपी के एनकाउंटर का मामला बॉम्बे हाई कोर्ट पहुंच गया। आरोपी अक्षय शिंदे के पिता ने मंगलवार को याचिका लगाकर एनकाउंटर की जांच के लिए एक विशेष जांच दल (SIT) गठित करने की मांग की है। मीडिया रिपोर्ट्स के मुताबिक, यह याचिका न्यायमूर्ति रेवती मोहिते डेरे और न्यायमूर्ति पृथ्वीराज चव्हाण की बेंच के सामने रखा गया है। उधर, महाराष्ट्र सरकार ने मंगलवार को एनकाउंटर की जांच CID को सौंप दी है। ठाणे क्राइम ब्रांच ने आरोपी अक्षय शिंदे का 23 सिंतबर को शाम करीब 6:15 बजे एनकाउंटर किया था, जिसमें उसकी मौत हो गई थी। जानकारी के मुताबिक ठाणे क्राइम ब्रांच अक्षय को तलोजा जेल से बदलापुर लेकर गई थी। सरकार ने कहा था कि अक्षय ने पुलिस की रिवॉल्वर छीनकर फायर किए थे, सेल्फ डिफेंस में पुलिस ने गोली चलाई और अक्षय मारा गया। इस घटना के बाद अक्षय के परिवार ने आरोप लगाया कि उसे कस्टडी में जमकर पीटा गया था। मामले को दबाने के लिए एनकाउंटर कर दिया गया। उसका शव भी नहीं देखने दिया। इधर विपक्ष ने सवाल किया- अक्षय हथकड़ी में था, वो फायरिंग कैसे कर सकता है। एनकाउंटर में मारे गए आरोपी की मां बोलीं- शव नहीं लेंगे
आरोपी शिंदे की मां ने कहा है कि हम अस्पताल में घंटों इंतजार करते रहे। लेकिन पुलिसवालों ने हमें अक्षय का शव भी देखने नहीं दिया। अक्षय के खिलाफ यौन शोषण के आरोप साबित नहीं हुए थे। वह पटाखे फोड़ने तक से डरता था। पुलिस पर गोली कैसे चला सकता है। एनकाउंटर एक साजिश है। अब हम उसका शव नहीं लेंगे। अक्षय ने बताया था कि पुलिस वाले उसे पीटते थे। दबाव डालकर बयान भी लिखवाते थे। आरोपी पर गोली चलाने वाले इंस्पेक्टर ने दाउद के भाई को पकड़ा था
बदलापुर के स्कूल में बच्चियों से दुष्कर्म के आरोपी अक्षय पर गोली चलाने वाले इंस्पेक्टर संजय शिंदे ठाणे क्राइम ब्रांच के एंटी-एक्सटॉर्शन सेल के हेड रह चुके हैं। वे एनकाउंटर स्पेशलिस्ट प्रदीप शर्मा की टीम में भी थे। इसी टीम ने 2017 में अंडरवर्ल्ड डॉन दाऊद के भाई इकबाल कासकर को गिरफ्तार किया था। बॉम्बे हाईकोर्ट ने 19 मार्च को एनकाउंटर स्पेशलिस्ट प्रदीप शर्मा को आजीवन जेल की सजा सुनाई थी। उन्हें 2006 में गैंगस्टर छोटा राजन के करीबी के फर्जी एनकाउंटर मामले में दोषी माना गया था। प्रदीप शर्मा की टीम के एनकाउंटर की कहानी पर डॉक्युमेंट्री सीरीज भी बन चुकी है। संजय शिंदे के खिलाफ 2012 में इन्क्वायरी भी हुई थी। 2012 में दो हत्या मामलों का आरोपी विजय पलांडे पुलिस हिरासत से भाग निकला था। वह जिस SUV से भागा था, उसमें संजय की वर्दी मिली थी। वे साल 2000 में भी किडनैपिंग केस में विवादों में आए थे। सरकार की तरफ से दो बयान: मुख्यमंत्री एकनाथ शिंदे: अक्षय शिंदे की पूर्व पत्नी ने उस पर यौन उत्पीड़न का मामला दर्ज कराया है। पुलिस उसे जांच के लिए ले गई थी। इस दौरान उसने एक पुलिसकर्मी नीलेश मोरे पर गोली चलाई, जो घायल हो गया। पुलिस ने सेल्फ डिफेंस में यह कार्रवाई की। जांच के बाद और जानकारी सामने आएगी। डिप्टी CM देवेंद्र फडणवीस: पुलिस वारंट के साथ अक्षय शिंदे को जांच के लिए ले जा रही थी। उसने पुलिस की पिस्टल छीन ली। उसने पुलिस कर्मियों पर गोली चलाई और हवाई फायरिंग भी की। पुलिस ने आत्मरक्षा में उस पर गोली चलाई। विपक्ष हर बात पर सवाल उठाता है। वही विपक्ष आरोपी को फांसी देने की मांग कर रहा था। विपक्ष बोला- मामला खत्म करने की कोशिश: NCP (शरद गुट) सांसद सुप्रिया सुले- बदलापुर में दो नाबालिग लड़कियों के यौन उत्पीड़न मामले में महायुति सरकार का रवैया चौंकाने वाला है। पहले FIR दर्ज करने में देरी हुई और अब मुख्य आरोपी की हिरासत में हत्या कर दी गई। यह कानून प्रवर्तन और न्याय प्रणाली का पूरी तरह से पतन है। शिवसेना (UBT) सांसद प्रियंका चतुर्वेदी- आरोपी मर चुका है, और POCSO के तहत अन्य सह-आरोपी, जो स्कूल बोर्ड का सदस्य और भाजपा पदाधिकारी था, वह अभी भी फरार है। अयोग्य सरकार की गोली मारो और भाग जाओ रणनीति बहुत किताबी केस है। जल्द सुनने में आएगा कि किसी ने भी 6 साल के बच्चियों का यौन उत्पीड़न किया ही नहीं। रीटेन, स्पॉन्सर्ड एंड एग्जीक्यूटेड बाय स्टेट गवर्नमेंट। कांग्रेस प्रदेश अध्यक्ष नाना पटोले- इस घटना ने कुछ गंभीर सवाल खड़े कर दिए हैं। बदलापुर अत्याचार मामले में स्कूल ट्रस्टी अभी भी गिरफ्तार नहीं हुए हैं, वे फरार हैं उन्हें अभी तक गिरफ्तार क्यों नहीं किया गया है? क्या इस मामले में फरार आरोपियों को बचाने के लिए मुख्य आरोपी का एनकाउंटर कर मामले को खत्म करने की कोशिश की जा रही है? क्या पूरे मामले को दबाने की कोशिश के तहत पुलिस ने आरोपी का एनकाउंटर किया है? इस मामले की सच्चाई सामने लाने के लिए हाईकोर्ट के जजों से जांच कराई जानी चाहिए। आरोपी ने 1 अगस्त को स्कूल जॉइन किया, 12-13 अगस्त को यौन शोषण किया
बच्चियों से रेप का आरोपी अक्षय शिंदे स्कूल में स्वीपर का काम करता था। वह 1 अगस्त को ही कॉन्ट्रैक्ट पर नियुक्त हुआ था। 12 और 13 अगस्त को उसने स्कूल के गर्ल्स वॉशरूम में किंडरगार्टन में पढ़ने वाली 3 और 4 साल की दो बच्चियों का यौन शोषण किया। घटना के बाद दोनों बच्चियां स्कूल जाने से डर रही थीं। एक बच्ची के माता-पिता को शक हुआ तो उन्होंने बेटी से पूछताछ की। इसके बाद बच्ची ने सारी बात बताई। फिर उस बच्ची के माता-पिता ने दूसरी बच्ची के पेरेंट से बात की। इसके बाद दोनों बच्चियों का मेडिकल टेस्ट हुआ, जिसमें यौन शोषण का खुलासा हुआ। आरोपी को दादा बोलती थीं बच्चियां, 17 अगस्त को गिरफ्तार हुआ था
पुलिस पूछताछ में सामने आया था कि बच्ची आरोपी शिंदे को दादा (बड़े भाई के लिए मराठी शब्द) कहकर बुलाती थी। बच्ची के मुताबिक, ‘दादा’ ने उसके कपड़े खोले और गलत तरीके से छुआ। स्कूल में जहां घटना हुई थी, वहां महिला कर्मचारी नहीं थी। दोनों बच्चियों का परिवार जब केस दर्ज कराने के लिए थाने पहुंचा, तो पुलिस ने भी FIR दर्ज करने में टालमटोल की। पीड़ित परिवारों ने सामाजिक कार्यकर्ताओं से मदद मांगी। दो दिन बाद 16 अगस्त की देर रात पुलिस ने शिकायत दर्ज की। पुलिस ने 17 अगस्त को आरोपी को गिरफ्तार किया था। लोगों ने ट्रेनें रोकी थीं, पुलिस पर पथराव किया था घटना को लेकर भीड़ ने 20 अगस्त को सुबह 8 बजे से शाम 6 बजे तक बदलापुर स्टेशन पर प्रदर्शन किया था। 10 घंटे से ज्यादा लोकल ट्रेनों की आवाजाही रुकी रही। शाम को पुलिस ने लाठीचार्ज कर रेलवे ट्रैक खाली कराया। तब पुलिस पर भीड़ ने पत्थरबाजी भी की थी। कैबिनेट मंत्री गिरीश महाजन प्रदर्शनकारियों से बातचीत करने के लिए बदलापुर स्टेशन पहुंचे, लेकिन उन्हें लौटना पड़ा था। इसके बाद उपमुख्यमंत्री देवेंद्र फडणवीस ने SIT गठित करने का ऐलान किया। इसके अलावा सरकार ने केस फास्ट ट्रैक कोर्ट में चलाने की बात कही थी। राज्य सरकार ने केस दर्ज करने में देरी के आरोप में बदलापुर थाने के महिला पुलिस निरीक्षक समेत 3 पुलिसकर्मियों को निलंबित कर दिया था। साथ ही प्रिंसिपल समेत कुछ स्कूल स्टाफ को भी सस्पेंड किया था। बाल आयोग ने कहा- स्कूल प्रशासन ने केस दबाने की कोशिश की
महाराष्ट्र राज्य बाल अधिकार संरक्षण आयोग की अध्यक्ष सुसीबेन शाह ने आरोप लगाया था कि स्कूल ने बच्चियों के पेरेंट्स की मदद करने के बजाय अपराध को छिपाया। स्कूल समय पर संज्ञान लेकर शिकायत दर्ज करवाता तो अराजक स्थिति से बचा जा सकता था। मामले को लेकर आयोग CM एकनाथ शिंदे को रिपोर्ट पेश कर चुका है।","{'type': 'text/html', 'language': None, 'base': 'https://www.bhaskar.com/rss-v1--category-2318.xml', 'value': 'बदलापुर दुष्कर्म केस में आरोपी के एनकाउंटर का मामला बॉम्बे हाई कोर्ट पहुंच गया। आरोपी अक्षय शिंदे के पिता ने मंगलवार को याचिका लगाकर एनकाउंटर की जांच के लिए एक विशेष जांच दल (SIT) गठित करने की मांग की है। मीडिया रिपोर्ट्स के मुताबिक, यह याचिका न्यायमूर्ति रेवती मोहिते डेरे और न्यायमूर्ति पृथ्वीराज चव्हाण की बेंच के सामने रखा गया है। उधर, महाराष्ट्र सरकार ने मंगलवार को एनकाउंटर की जांच CID को सौंप दी है। ठाणे क्राइम ब्रांच ने आरोपी अक्षय शिंदे का 23 सिंतबर को शाम करीब 6:15 बजे एनकाउंटर किया था, जिसमें उसकी मौत हो गई थी। जानकारी के मुताबिक ठाणे क्राइम ब्रांच अक्षय को तलोजा जेल से बदलापुर लेकर गई थी। सरकार ने कहा था कि अक्षय ने पुलिस की रिवॉल्वर छीनकर फायर किए थे, सेल्फ डिफेंस में पुलिस ने गोली चलाई और अक्षय मारा गया। इस घटना के बाद अक्षय के परिवार ने आरोप लगाया कि उसे कस्टडी में जमकर पीटा गया था। मामले को दबाने के लिए एनकाउंटर कर दिया गया। उसका शव भी नहीं देखने दिया। इधर विपक्ष ने सवाल किया- अक्षय हथकड़ी में था, वो फायरिंग कैसे कर सकता है। एनकाउंटर में मारे गए आरोपी की मां बोलीं- शव नहीं लेंगे\nआरोपी शिंदे की मां ने कहा है कि हम अस्पताल में घंटों इंतजार करते रहे। लेकिन पुलिसवालों ने हमें अक्षय का शव भी देखने नहीं दिया। अक्षय के खिलाफ यौन शोषण के आरोप साबित नहीं हुए थे। वह पटाखे फोड़ने तक से डरता था। पुलिस पर गोली कैसे चला सकता है। एनकाउंटर एक साजिश है। अब हम उसका शव नहीं लेंगे। अक्षय ने बताया था कि पुलिस वाले उसे पीटते थे। दबाव डालकर बयान भी लिखवाते थे। आरोपी पर गोली चलाने वाले इंस्पेक्टर ने दाउद के भाई को पकड़ा था\nबदलापुर के स्कूल में बच्चियों से दुष्कर्म के आरोपी अक्षय पर गोली चलाने वाले इंस्पेक्टर संजय शिंदे ठाणे क्राइम ब्रांच के एंटी-एक्सटॉर्शन सेल के हेड रह चुके हैं। वे एनकाउंटर स्पेशलिस्ट प्रदीप शर्मा की टीम में भी थे। इसी टीम ने 2017 में अंडरवर्ल्ड डॉन दाऊद के भाई इकबाल कासकर को गिरफ्तार किया था। बॉम्बे हाईकोर्ट ने 19 मार्च को एनकाउंटर स्पेशलिस्ट प्रदीप शर्मा को आजीवन जेल की सजा सुनाई थी। उन्हें 2006 में गैंगस्टर छोटा राजन के करीबी के फर्जी एनकाउंटर मामले में दोषी माना गया था। प्रदीप शर्मा की टीम के एनकाउंटर की कहानी पर डॉक्युमेंट्री सीरीज भी बन चुकी है। संजय शिंदे के खिलाफ 2012 में इन्क्वायरी भी हुई थी। 2012 में दो हत्या मामलों का आरोपी विजय पलांडे पुलिस हिरासत से भाग निकला था। वह जिस SUV से भागा था, उसमें संजय की वर्दी मिली थी। वे साल 2000 में भी किडनैपिंग केस में विवादों में आए थे। सरकार की तरफ से दो बयान: मुख्यमंत्री एकनाथ शिंदे: अक्षय शिंदे की पूर्व पत्नी ने उस पर यौन उत्पीड़न का मामला दर्ज कराया है। पुलिस उसे जांच के लिए ले गई थी। इस दौरान उसने एक पुलिसकर्मी नीलेश मोरे पर गोली चलाई, जो घायल हो गया। पुलिस ने सेल्फ डिफेंस में यह कार्रवाई की। जांच के बाद और जानकारी सामने आएगी। डिप्टी CM देवेंद्र फडणवीस: पुलिस वारंट के साथ अक्षय शिंदे को जांच के लिए ले जा रही थी। उसने पुलिस की पिस्टल छीन ली। उसने पुलिस कर्मियों पर गोली चलाई और हवाई फायरिंग भी की। पुलिस ने आत्मरक्षा में उस पर गोली चलाई। विपक्ष हर बात पर सवाल उठाता है। वही विपक्ष आरोपी को फांसी देने की मांग कर रहा था। विपक्ष बोला- मामला खत्म करने की कोशिश: NCP (शरद गुट) सांसद सुप्रिया सुले- बदलापुर में दो नाबालिग लड़कियों के यौन उत्पीड़न मामले में महायुति सरकार का रवैया चौंकाने वाला है। पहले FIR दर्ज करने में देरी हुई और अब मुख्य आरोपी की हिरासत में हत्या कर दी गई। यह कानून प्रवर्तन और न्याय प्रणाली का पूरी तरह से पतन है। शिवसेना (UBT) सांसद प्रियंका चतुर्वेदी- आरोपी मर चुका है, और POCSO के तहत अन्य सह-आरोपी, जो स्कूल बोर्ड का सदस्य और भाजपा पदाधिकारी था, वह अभी भी फरार है। अयोग्य सरकार की गोली मारो और भाग जाओ रणनीति बहुत किताबी केस है। जल्द सुनने में आएगा कि किसी ने भी 6 साल के बच्चियों का यौन उत्पीड़न किया ही नहीं। रीटेन, स्पॉन्सर्ड एंड एग्जीक्यूटेड बाय स्टेट गवर्नमेंट। कांग्रेस प्रदेश अध्यक्ष नाना पटोले- इस घटना ने कुछ गंभीर सवाल खड़े कर दिए हैं। बदलापुर अत्याचार मामले में स्कूल ट्रस्टी अभी भी गिरफ्तार नहीं हुए हैं, वे फरार हैं उन्हें अभी तक गिरफ्तार क्यों नहीं किया गया है? क्या इस मामले में फरार आरोपियों को बचाने के लिए मुख्य आरोपी का एनकाउंटर कर मामले को खत्म करने की कोशिश की जा रही है? क्या पूरे मामले को दबाने की कोशिश के तहत पुलिस ने आरोपी का एनकाउंटर किया है? इस मामले की सच्चाई सामने लाने के लिए हाईकोर्ट के जजों से जांच कराई जानी चाहिए। आरोपी ने 1 अगस्त को स्कूल जॉइन किया, 12-13 अगस्त को यौन शोषण किया\nबच्चियों से रेप का आरोपी अक्षय शिंदे स्कूल में स्वीपर का काम करता था। वह 1 अगस्त को ही कॉन्ट्रैक्ट पर नियुक्त हुआ था। 12 और 13 अगस्त को उसने स्कूल के गर्ल्स वॉशरूम में किंडरगार्टन में पढ़ने वाली 3 और 4 साल की दो बच्चियों का यौन शोषण किया। घटना के बाद दोनों बच्चियां स्कूल जाने से डर रही थीं। एक बच्ची के माता-पिता को शक हुआ तो उन्होंने बेटी से पूछताछ की। इसके बाद बच्ची ने सारी बात बताई। फिर उस बच्ची के माता-पिता ने दूसरी बच्ची के पेरेंट से बात की। इसके बाद दोनों बच्चियों का मेडिकल टेस्ट हुआ, जिसमें यौन शोषण का खुलासा हुआ। आरोपी को दादा बोलती थीं बच्चियां, 17 अगस्त को गिरफ्तार हुआ था\nपुलिस पूछताछ में सामने आया था कि बच्ची आरोपी शिंदे को दादा (बड़े भाई के लिए मराठी शब्द) कहकर बुलाती थी। बच्ची के मुताबिक, ‘दादा’ ने उसके कपड़े खोले और गलत तरीके से छुआ। स्कूल में जहां घटना हुई थी, वहां महिला कर्मचारी नहीं थी। दोनों बच्चियों का परिवार जब केस दर्ज कराने के लिए थाने पहुंचा, तो पुलिस ने भी FIR दर्ज करने में टालमटोल की। पीड़ित परिवारों ने सामाजिक कार्यकर्ताओं से मदद मांगी। दो दिन बाद 16 अगस्त की देर रात पुलिस ने शिकायत दर्ज की। पुलिस ने 17 अगस्त को आरोपी को गिरफ्तार किया था। लोगों ने ट्रेनें रोकी थीं, पुलिस पर पथराव किया था घटना को लेकर भीड़ ने 20 अगस्त को सुबह 8 बजे से शाम 6 बजे तक बदलापुर स्टेशन पर प्रदर्शन किया था। 10 घंटे से ज्यादा लोकल ट्रेनों की आवाजाही रुकी रही। शाम को पुलिस ने लाठीचार्ज कर रेलवे ट्रैक खाली कराया। तब पुलिस पर भीड़ ने पत्थरबाजी भी की थी। कैबिनेट मंत्री गिरीश महाजन प्रदर्शनकारियों से बातचीत करने के लिए बदलापुर स्टेशन पहुंचे, लेकिन उन्हें लौटना पड़ा था। इसके बाद उपमुख्यमंत्री देवेंद्र फडणवीस ने SIT गठित करने का ऐलान किया। इसके अलावा सरकार ने केस फास्ट ट्रैक कोर्ट में चलाने की बात कही थी। राज्य सरकार ने केस दर्ज करने में देरी के आरोप में बदलापुर थाने के महिला पुलिस निरीक्षक समेत 3 पुलिसकर्मियों को निलंबित कर दिया था। साथ ही प्रिंसिपल समेत कुछ स्कूल स्टाफ को भी सस्पेंड किया था। बाल आयोग ने कहा- स्कूल प्रशासन ने केस दबाने की कोशिश की\nमहाराष्ट्र राज्य बाल अधिकार संरक्षण आयोग की अध्यक्ष सुसीबेन शाह ने आरोप लगाया था कि स्कूल ने बच्चियों के पेरेंट्स की मदद करने के बजाय अपराध को छिपाया। स्कूल समय पर संज्ञान लेकर शिकायत दर्ज करवाता तो अराजक स्थिति से बचा जा सकता था। मामले को लेकर आयोग CM एकनाथ शिंदे को रिपोर्ट पेश कर चुका है।'}","Mon, 23 Sep 2024 20:29:02 +0000","time.struct_time(tm_year=2024, tm_mon=9, tm_mday=23, tm_hour=20, tm_min=29, tm_sec=2, tm_wday=0, tm_yday=267, tm_isdst=0)","[{'url': 'https://images.bhaskarassets.com/thumb/1000x1000/web2images/521/2024/09/24/gifs45_1727166389.gif', 'type': 'image/gif', 'width': '1000', 'height': '1000'}]",Dainik Bhaskar,Maharashtra,,,,2024-10-04 11:13:10.539244
